Name,Case,Body,Diagnoses,DiscussionA Downward Spiral,16.5,"Raymond Xavier, a divorced 29-year-old semi-employed landscaper, presented to a private psychiatrist with a complaint that his life was in a downward spiral. At the time of the appointment, he had been without a permanent home for over 6 months. He had lived in various places, including his car and friends’ homes. For over 1 month prior to presentation, he had been living in a tent in the woods. He had called his parents on his recent birthday, and they had offered to pay for substance abuse treatment as long as they could pay directly.Mr. Xavier reported that his problem started at age 24, when he had a new wife and young child and had taken on two jobs to make ends meet (working in a factory and as a local delivery driver). When he injured his back and could not get to work because of the pain, a friend offered him a few tablets of acetaminophen-oxycodone (Percocet). Not only did his pain disappear, but his energy and mood improved. For the first time in his life, he felt “normal and happy.”Mr. Xavier continued to use one to four Percocet tablets per day for 1½ years. He never took more than one pill at a time. Then, at age 26, he snorted half a bag of heroin (about $5 on the street). “It took about 10 minutes, but I was transported into an indescribable euphoria. Like taking that first Percocet times 10. . . . You chase that first feeling for the rest of your life. It never repeats.” Within months of starting heroin, he began using it intravenously in an effort to glimpse the euphoria again.After that first experience with heroin, the progression of use was rapid. Within 6 months, Mr. Xavier was unemployed, separated from his family, and homeless. “I was sleeping in my car or on the streets . . . using up to 30 bags [$300] daily.”Mr. Xavier began to reach out for help. He enrolled in outpatient rehabilitation for opioid users. The cravings to use, even while in treatment, were intense. Mr. Xavier reported multiple relapses. He added cocaine to the heroin injections, and “speedballs” became Mr. Xavier’s drug of choice for a while, but he then returned to using only heroin. The first of multiple accidental overdoses occurred in a vacant house when he was 27. He had been admitted to “about 10 detoxes and rehabs” but would typically relapse within hours or weeks of discharge. He had also gone sporadically to Narcotics Anonymous meetings for years.To acquire money for his habit, he broke into homes, stole from relatives, and wrote bad checks. “Every penny went to drugs. I’m lucky not to be in prison, but not so lucky in that everybody hates me.”He decided to move to Martha’s Vineyard a year prior to the consultation because it “sounded like a quiet place.” He brought some methadone with him, but the eventual withdrawal was “fierce.”He continued to use heroin and oxycodone when he could easily get them. Otherwise, he drank alcohol heavily, although he said, “I need to stop drinking—that’s what really gets me in trouble.” He also took diazepam (Valium) sporadically; however, he did not consider that to be a problem but more of a way to get through the day.He worked occasionally as a landscaper. His boss—someone he had met at a Narcotics Anonymous meeting—had made it clear that he would call when there was extra work to be done, but that until Mr. Xavier got clean, the boss would not actually expect him to show up. He had held a variety of other odd jobs, including office supplies salesman, veterinary assistant, and gas station attendant. He had not seen his daughter in over 2 years.On examination, Mr. Xavier appeared somewhat unkempt. He was generally cooperative but appeared restless, and at one point he urgently left the room; when he returned, he reported that he was experiencing bouts of diarrhea. His pupils were enlarged and his skin was remarkable for sweating and piloerection. He yawned several times and appeared irritable and unhappy. His arms and legs frequently twitched. He repeatedly blew his nose and appeared tearful. His speech was rapid, and he appeared impatient. He denied psychotic symptoms, suicidality, and homicidality. He said he was hopeful that if he could get some Suboxone (buprenorphine and naloxone), he might be able to keep a job and maybe get to be a real father.","Opioid withdrawalOpioid use disorderAlcohol use disorder","In response to not taking heroin or methadone, Mr. Xavier experiences a cluster of symptoms that are typical of acute opioid withdrawal. These include diarrhea, lacrimation and rhinorrhea, pupillary dilation, sweating, yawning, restlessness, and occasional spasms of his legs (from which the phrase “kicking the habit” is derived). He has a dysphoric, anxious mood.Symptoms that are attributable to acute opioid withdrawal overlap with a variety of other DSM-5 disorders. For example, Mr. Xavier’s anxiety and depression are significant but likely to be directly related to the withdrawal experience; in such a situation, neither warrants a separate diagnosis. If the symptoms extend beyond the immediate withdrawal period (the duration of which varies with the half-life of the particular opioid), then the likely diagnosis would be a substance-induced depressive (or anxiety) disorder. If the symptoms persist 1 month after discontinuation of the substance, then an autonomous disorder could be diagnosed (even if triggered by the substance use).The patient also reports significant alcohol abuse as well as sporadic use of diazepam. Both can have intense withdrawal symptoms and could be contributing to the current clinical picture. Neither, however, induces the fairly specific opioid withdrawal symptoms of lacrimation, yawns, and diarrhea. Mr. Xavier does not quantify his alcohol use, but he does say, “I need to stop drinking—that’s what really gets me in trouble.” Even without much of a clarification of his use, he describes drinking more than he intends and having drinking-related problems; this qualifies him for an alcohol use disorder.Mr. Xavier has stolen from strangers and family, has abandoned his wife and child, and is apparently an unreliable employee. This might lead to a consideration of antisocial personality disorder. Heroin is illegal and expensive, however, and it is almost impossible for the average user to acquire enough heroin through a legitimate job. For this reason, DSM-5 specifically suggests not diagnosing antisocial personality disorder when the behavior directly stems from efforts to acquire drugs. If, however, the antisocial behavior was evident in childhood or before the onset of the substance abuse, both diagnoses can be made. Without a history of antisocial behavior unrelated to the acquisition of heroin, Mr. Xavier would likely not meet criteria for antisocial personality disorder. He might, however, warrant a diagnosis of adult antisocial behavior, which is listed in the chapter “Other Conditions That May Be a Focus of Clinical Attention.” Like other diagnoses that are listed in that chapter but not in the main text of DSM-5, adult antisocial behavior is linked to a V code from ICD-9 and a Z code from ICD-10.More clear-cut, of course, is Mr. Xavier’s severe opioid use disorder, a diagnosis that refers to the compulsive, prolonged self-administered use of opioids without medical supervision. Mr. Xavier’s opioid use meets all 11 DSM-5 criteria: taking larger amounts than intended; inability to cut down; excessive time spent obtaining, using, and recovering from the opioid’s effects; craving; an inability to fulfill role obligations; persistent social and interpersonal problems; reduced activities; putting oneself at physical risk; continued use despite knowledge of its consequences; tolerance; and withdrawal.In many ways Mr. Xavier’s is a classic presentation. Onset is typically in the late teens and early 20s. The experience of feeling “normal and happy” with first use is common, as is “chasing the high,” the relentless pursuit of that initial sense of well-being and euphoria. Some opioid users maintain jobs and families, but many fall into a desperately negative spiral. Mr. Xavier is atypical in one way, however, because he has not been infected with one of the viruses commonly found in intravenous substance users: HIV and hepatitis A, B, and C.""Stress and Substance Abuse",16.6,"Shaun Yates, a 34-year-old African American college student, presented for evaluation of chronic mood instability. His symptoms had persisted and worsened in the decade since he returned from a 12-month military tour in Iraq. Mr. Yates denied having had significant psychiatric symptoms prior to his enlistment. During his deployment, he worked in transportation, and although he was not directly involved in combat, he “lost many comrades.” This was his first psychiatric evaluation. He did not “like to talk about this stuff,” but his wife insisted.Upon presentation, Mr. Yates reported that his mood was “down.” He felt that he was “sleepwalking” most of the time and not enjoying his wife or two young children. He reported restlessness, as well as uncalled-for vigilance whenever he went to public places. He avoided driving, especially over bridges, and preferred to “stick around the neighborhood.” His sleep was regularly interrupted by vivid, disturbing dreams about “bombs and land mines.” After several years of underemployment that was partly attributable to these symptoms, his wife had convinced him to go back to college to have more job flexibility in the future.Mr. Yates reported concentration difficulties since his return from the service. Cocaine initially helped, but his ability to study declined with escalating cocaine use. He reported some guilt related to sexual behavior while using, but he denied feelings of worthlessness or hopelessness. He had a remote history of passive suicidality (“fleeting thoughts”), but he denied active suicidal ideation and suicide attempts. His appetite was good, and he denied any history of panic attacks, mania, psychosis, or obsessive-compulsive symptoms. He denied a history of psychiatric hospitalization or outpatient treatment. There was no family psychiatric history aside from a father with alcohol abuse.Mr. Yates first consumed alcohol on weekends when he was age 14. He had an early high tolerance, requiring 1 pint of alcohol to “get drunk.” Mr. Yates reported that his drinking escalated somewhat in the military—“maybe a little out of control”—and that he experienced regular blackouts. After discharge, he would typically drink 1 pint every 2–3 days, but sometimes more. During periods of heavy use, he had occasional morning tremors that were resolved by drinking. He denied other withdrawal symptoms, but the morning drinking reminded him of his father, who ultimately died of cirrhosis at age 56, so he began to limit his drinking to weekends. Since the onset of frequent cocaine use, he had begun to use alcohol to “come down” from the cocaine high. He denied a history of legal complications or arrests.Beginning in high school, Mr. Yates smoked cannabis socially, never smoking more often than twice per month. During the year prior to the evaluation, he found that marijuana helped with insomnia, and he began to crave it every evening. His wife objected, arguing that he would eventually get caught by either the police or their children. He continued to use the marijuana, despite the nightly arguments, because cannabis led to the greatest likelihood that he would sleep without nightmares.Mr. Yates identified cocaine as his overall drug of choice. He had first used cocaine a few years after he left the service. He used primarily by “snorting,” although he did experiment with smoking crack cocaine. He denied ever using intravenous drugs. Over the prior year, his cocaine costs had increased to $200 per week, and he found himself pawning items and missing class and work, especially when he was especially depressed after using. Although his wife did not know about the cocaine or its role in his overall performance, he was making little progress toward his college degree and had lost at least three jobs because of cocaine-related absenteeism. In the past year, Mr. Yates had begun using phencyclidine (PCP) to lower the cost. He would dip joints (marijuana cigarettes) in PCP before smoking.Mr. Yates consumed other substances when he found them easily available, generally at parties. These included ecstasy (estimated 10 lifetime uses), benzodiazepines (estimated 20 lifetime uses), and prescription opiates (estimated 5 lifetime uses). He had also smoked 3–5 cigarettes per day since age 16. His efforts to quit smoking failed because of persistent craving and withdrawal symptoms.","Posttraumatic stress disorderCocaine use disorder, severeAlcohol use disorder, mildCannabis use disorder, mildTobacco use disorder, mild","Mr. Yates presents for evaluation of “chronic mood instability” that could be related to traumatic experiences in the military, chronic substance abuse, or an essentially unrelated psychiatric condition. He might view his substance use as “self-medication,” but one or more of these substances might be inducing or exacerbating a psychiatric disorder. Clarification of these diagnoses is crucial.Mr. Yates came to the psychiatrist because of his unstable mood and declining functioning. Given the apparent development of these symptoms since his military service, it is reasonable to explore the possibility of posttraumatic stress disorder (PTSD), a diagnosis that can bring together a variety of seemingly disparate symptoms. Although Mr. Yates did not engage in combat, he reports that he “lost many comrades.” Furthermore, his work in transportation during the early years of the war in Iraq would have been especially dangerous given the possibility of land mines and suicide bombers. In addition to some sort of trauma, PTSD requires symptoms from four different clusters: intrusion (e.g., nightmares of bombs), avoidance (e.g., of bridges and driving), negative alterations in cognitions and mood (depression, detachment), and arousal (excess vigilance). In Mr. Yates, these symptoms have persisted for more than 1 month and affect his life. The one criterion whose status is not immediately clear is whether the disturbance is attributable to the physiological effects of a substance.Mr. Yates began his long, varied substance abuse at age 14, with alcohol. His use progressed to involve cannabis, benzodiazepines, ecstasy, prescription opioids, cocaine, PCP, and tobacco. As a group, the substances have contributed to his deteriorating grades, physically hazardous behaviors (i.e., blackouts, risky sexual practices), marital discord (arguments about the marijuana), and, presumably, worsening of his underlying PTSD symptoms.Under DSM-IV, it would have been fairly straightforward to provide Mr. Yates with a diagnosis of polysubstance dependence. Such a broad diagnosis, however, can short-circuit an inquiry into which substances are actually a problem, and may not be especially helpful in regard to treatment. For these reasons, DSM-5 eliminated the term polysubstance. Instead, Mr. Yates’s use of each of the substances should be independently assessed to determine whether a clinically relevant threshold has been reached.Cocaine is Mr. Yates’s substance of choice. It has also caused the most impairment. His cocaine use led to three lost jobs, poor school performance, the pawning of personal items, and recurrent postuse dysphoria. Although he recognizes the negative consequences and has tried to cut back, his use has escalated. Meeting at least seven of 11 criteria, Mr. Yates has a severe DSM-5 cocaine use disorder.At its worst, Mr. Yates’s alcohol use included blackouts, withdrawal tremor, and getting “a little out of control.” The case report does not indicate whether his alcohol use caused other problems, but he still meets criteria for at least a mild alcohol use disorder because of his drinking while in the military. If looked at cross-sectionally at the time of the evaluation, his diminished use does not appear to meet the requirement of two of 11 symptomatic criteria. Nevertheless, DSM-5 emphasizes that once criteria for a substance use disorder have been met, “remission” is not reached until the individual meets none of the criteria (aside from craving). Mr. Yates would, therefore, still meet criteria for an alcohol use disorder.The evaluation of Mr. Yates’s cannabis use is more complicated. This substance seems to help him sleep, and he does not report direct adverse effects. He does, however, crave the substance, and its use is causing marital problems; therefore, he meets DSM-5 criteria for mild cannabis use disorder. In regard to tobacco, he only smokes 3–5 cigarettes per day, but he craves the substance, and when he has recurrently tried to stop, he has failed because of withdrawal. These symptoms qualify him for a mild tobacco use disorder. Although he has used ecstasy, benzodiazepines, and prescription opiates, his use of these substances does not appear to meet criteria for a DSM-5 disorder.Patients often abuse more than one substance, and drug effects can interact in complex ways with other psychiatric diagnoses such as PTSD. A longitudinal understanding of all of Mr. Yates’s psychiatric diagnoses, including his use of multiple substances, is critical to both understanding the patient and developing a workable treatment plan."Gambling,16.7,"Tomás Zambrano was a 36-year-old married first-generation Hispanic man who presented to the gambling clinic at a major medical center for evaluation and treatment.A football coach at a suburban high school, Mr. Zambrano had a 5-year-old son. He denied having any prior psychiatric or substance abuse history. He was appropriately dressed and groomed, expressed himself fluently in both English and Spanish, spoke in normal tone and volume, and on examination presented with intact cognitive function and average intelligence.Mr. Zambrano had been betting on sports and playing cards since childhood, noting in the evaluation that gambling “is part of our culture.” His own father’s favorite hobby and stress reliever had been to play poker with friends at night, and Mr. Zambrano remembered with affection the father-son moments they shared. Poker became for him a familial activity that he increasingly used to relieve work-related stress. He relished the excitement as well as the intellectual challenge and competition.Card games did not, however, remain a benign pastime for Mr. Zambrano. He had begun to lose more money than he could afford. Over the prior 2 years, he had gradually increased the frequency and stakes of his poker nights. When he lost, he placed even larger bets, convinced that the odds would favor him the next time. When he won, he felt great and would continue to play, convinced he was “on a streak.” Although losses made him feel unworthy, stupid, and irritable, he believed success would come if he could fine-tune his strategy. He felt a powerful, almost constant impulse to increase the tempo of his gambling and recover the money he had lost. When he tried to cut back on gambling, he felt irritable and preoccupied, and quickly returned to his poker nights.By the time Mr. Zambrano presented to the gambling clinic, he felt desperate. Nightly poker had led to daytime fatigue and poor performance at his coaching job, which he had previously loved. He was consumed with thoughts about his next poker game. His wife and son had long resented his time away from the family, but his wife had just found out that he had used up his son’s college fund plus accumulated $30,000 in credit card debt. When his wife threatened to file for divorce, he felt sad and depressed and decided to seek treatment.",Gambling disorder,"Mr. Zambrano is preoccupied with gambling, has a recurrent pattern of chasing his losses, and has been gambling with escalating amounts of money. He lies to his wife about his losses and has jeopardized his marital relationship and his job. Mr. Zambrano demonstrates at least five of nine criteria for DSM-5 gambling disorder (four of the nine are required for the diagnosis).If excess gambling is a symptom of a manic episode, the gambling disorder diagnosis is not made. When manic episode is the principal diagnosis, the patient tends to gamble mostly in the context of excitement and grandiosity and will display other symptoms of bipolar disorder, such as increased energy and diminished need for sleep. When gambling is used as a maladaptive coping response, the individual tends to engage in gambling activities mostly during negative mood states, such as anxiety and depression. The clinician should also keep in mind that gambling losses can trigger mood episodes, generally adjustment disorders, although comorbid major depressive disorder and mania or hypomania may also occur. Assessment of the temporal relationship among symptoms and the intensity of those symptoms helps to establish the principal diagnosis. In this case, Mr. Zambrano specifically denied all manic symptoms.Mr. Zambrano is somewhat unusual in his denial of all psychiatric comorbidity. A large percentage of people with gambling disorder have a substance use disorder, personality disorder, mood disorder, and/or anxiety disorder. Because accurate assessment of comorbidity is essential for treatment decisions, it would be useful for the clinician to explore the possibility that Mr. Zambrano is minimizing other symptomatology.Mr. Zambrano is more typical in having a father who was also a gambler. Many people with gambling disorders also report first-degree relatives who gamble, although it is not clear the degree to which the behavior is learned versus genetically inherited."