Name,Case,Body,Diagnoses,Discussion A Second Opinion on Autism,1.1,"Ashley, age 17, was referred for a diagnostic reevaluation after having carried diagnoses of autism and mental retardation for almost all of her life. She was recently found to have Kleefstra syndrome, and the family would like to reconfirm the earlier diagnoses and assess the genetic risk to the future children of her older sisters.At the time of the reevaluation, Ashley was attending a special school with a focus on functional skills. She was able to dress herself, but she was not able to shower independently or be left alone in the house. She was able to decode (e.g., read words) and spell at a second-grade level but understood little of what she read. Changes to her schedule and heightened functional expectations tended to make her irritable. When upset, Ashley would often hurt herself (e.g., biting her wrist) and others (e.g., pinching and hair pulling).In formal testing done at the time of the reevaluation, Ashley had a nonverbal IQ of 39 and a verbal IQ of 23, with a full scale IQ of 31. Her adaptive scores were somewhat higher, with an overall score of 42 (with 100 as average).By history, Ashley first received services at age 9 months after her parents noticed significant motor delays. She walked at 20 months and was toilet trained at 5 years. She spoke her first word at age 6. She received a diagnosis of developmental delay at age 3 and of autism, obesity, and static encephalopathy at age 4. An early evaluation noted possible facial dysmorphology; genetic tests at that time were noncontributory.Her parents indicated that Ashley knew hundreds of single words and many simple phrases. She had long been very interested in license plates and would draw them for hours. Her strongest skill was memory, and she could draw precise representations of license plates from different states. Ashley had always been very attached to her parents and sisters, and although affectionate toward babies, she showed minimal interest in other teenagers.Ashley’s family history was pertinent for a father with dyslexia, a paternal uncle with epilepsy, and a maternal male cousin with possible “Asperger’s syndrome.” Her siblings, both sisters, were in college and doing well.On examination, Ashley was an overweight young woman who made inconsistent eye contact but often peered out the corner of her eye. She had a beautiful smile and would sometimes laugh to herself, but most of the time her facial expressions were subdued. She did not initiate joint attention by trying to catch another person’s eyes. She frequently ignored what others would say to her. To request a preferred object (e.g., a shiny magazine), Ashley would rock from foot to foot and point. When offered an object (e.g., a stuffed animal), she brought it to her nose and lips for inspection. Ashley spoke in a high-pitched voice with unusual intonation. During the interview, she used multiple words and a few short phrases that were somewhat rote but communicative, such as “I want to clean up,” and “Do you have a van?”In the months prior to the evaluation, Ashley’s parents noticed that she had become increasingly apathetic. A medical evaluation concluded that urinary tract infections were the most likely cause for her symptoms, but antibiotics seemed only to make her more listless. Further medical evaluation led to more extensive genetic testing, and Ashley was diagnosed with Kleefstra syndrome, a rare genetic defect associated with multiple medical problems including intellectual disability. The parents said they were also checked and found to “be negative.”The parents specifically wanted to know whether the genetic testing results affected Ashley’s long-standing diagnoses and access to future services. Furthermore, they wanted to know whether their other two daughters should get tested for their risk of carrying genes for autism, mental retardation, and/or Kleefstra syndrome.","Intellectual disability, severeAutism spectrum disorder, with accompanying intellectual and language impairments, associated with Kleefstra syndrome","In regard to diagnosis, Ashley’s cognitive testing and limited everyday adaptive skills indicate that she has DSM-5 intellectual disability. In addition, Ashley has prominent symptoms from both of the core symptomatic criteria of autism spectrum disorder (ASD): 1) deficits in social communication and 2) restricted, repetitive patterns of behavior, interests, or activities. Ashley also fulfills the DSM-5 ASD requirement of having had symptoms in the early developmental period and a history of significant impairment. A fifth requirement for ASD is that the disturbances are not better explained by intellectual disability, which is a more complicated question in Ashley’s case.For many years, clinicians and researchers have debated the boundary between autism and intellectual disabilities. As IQ decreases, the proportion of children and adults who meet criteria for autism increases. Most individuals with IQs below 30 have ASD as well as intellectual disability.For Ashley to meet DSM-5 criteria for both ASD and intellectual disability, the specific deficits and behaviors associated with ASD must be greater than what would ordinarily be seen in people with her overall intellectual development. In other words, if her deficits were due solely to limited intellectual abilities, she would be expected to have the social and play skills of a typical 3- to 4-year-old child. Ashley’s social interaction is not at all like that of a typical preschooler, however, and never has been. She has limited facial expressions, poor eye contact, and minimal interest in peers. Compared to her “mental age,” Ashley demonstrates significant restriction in both her range of interests and her understanding of basic human emotions. Furthermore, she manifests behaviors that are not seen commonly at any age.The heterogeneity of autism has led to significant conflict. Some argue, for example, that children with very severe intellectual disabilities should be excluded from ASD. Others argue that more intellectually able children with ASD should be placed into their own category, Asperger syndrome. Research does not support either of these distinctions. For example, studies indicate that children with autistic symptoms and severe intellectual disability often have siblings with autism and stronger intellectual abilities. Much remains to be known about ASD, but IQ does not appear to be the key distinguishing factor.From a pragmatic perspective, the critical factor is whether an ASD diagnosis offers information that helps guide treatment and the availability of services. For Ashley, the ASD diagnosis encourages a focus on her poor social skills. It calls attention to differences in her motivation and in her need for structure. The ASD diagnosis also underlines the importance of looking carefully for her cognitive strengths (e.g., rote memory and visual representation) and weaknesses (e.g., comprehension, social interaction, and an ability to adapt to change). All of these may play a large role in her efforts to live as independently as possible.Ashley’s parents are also concerned about the impact of the recent genetic testing results on Ashley’s treatment and on her sisters’ family planning. Hundreds of individual genes may play a role in the complex neurological issues involved in autism, but most cases of ASD lack a clear cause. Ashley’s genetic condition, Kleefstra syndrome, is reliably associated with both intellectual disability and ASD symptoms. When a genetic or medical condition or environmental factor appears to be implicated, it is listed as a specifier, but the ASD diagnosis is not otherwise affected.Knowledge of the genetic cause for Ashley’s intellectual disability and ASD is important for several reasons. It reminds her physicians to look for medical comorbidities that are common in Kleefstra syndrome, such as problems with the heart and kidneys (possibly leading, for example, to her recurrent urinary tract infections). Knowledge of the genetic cause also expands informational resources by connecting Ashley’s family to other families that are affected by this rare syndrome.A particularly important aspect of this new genetic diagnosis is its effect on Ashley’s sisters. In almost all reported cases, Kleefstra syndrome has occurred de novo, meaning that there is an extremely low likelihood that anyone else in her family has any abnormality in the affected gene region. On rare occasions, an unaffected parent has a chromosomal translocation or mosaicism that leads to the syndrome, but the fact that Ashley’s parents were found to “be negative” implies they are not genetic carriers. Although this is not necessarily true for situations involving other autism-related genetic disorders, this particular genetic diagnosis in Ashley likely indicates her sisters are not at increased risk for having children with autism. Such information can be very reassuring and useful to Ashley’s sisters. The fact remains that although genetics undoubtedly plays a large role in autism and intellectual disability, most cases cannot be reliably predicted, and diagnosis is made through ongoing, longitudinal observation during childhood."Temper Tantrums,1.2,"Brandon was a 12-year-old boy brought in by his mother for psychiatric evaluation for temper tantrums that seemed to be contributing to declining school performance. The mother became emotional as she reported that things had always been difficult but had become worse after Brandon entered middle school.Brandon’s sixth-grade teachers reported that he was academically capable but that he had little ability to make friends. He seemed to mistrust the intentions of classmates who tried to be nice to him, and then trusted others who laughingly feigned interest in the toy cars and trucks that he brought to school. The teachers noted that he often cried and rarely spoke in class. In recent months, multiple teachers had heard him screaming at other boys, generally in the hallway but sometimes in the middle of class. The teachers had not identified a cause but generally had not disciplined Brandon because they assumed he was responding to provocation.When interviewed alone, Brandon responded with nonspontaneous mumbles when asked questions about school, classmates, and his family. When the examiner asked if he was interested in toy cars, however, Brandon lit up. He pulled several cars, trucks, and airplanes from his backpack and, while not making good eye contact, did talk at length about vehicles, using their apparently accurate names (e.g., front-end loader, B-52, Jaguar). When asked again about school, Brandon pulled out his cell phone and showed a string of text messages: “dumbo!!!!, mr stutter, LoSeR, freak!, EVERYBODY HATES YOU.” While the examiner read the long string of texts that Brandon had saved but apparently not previously revealed, Brandon added that other boys would whisper “bad words” to him in class and then scream in his ears in the hall. “And I hate loud noises.” He said he had considered running away, but then had decided that maybe he should just run away to his own bedroom.Developmentally, Brandon spoke his first word at age 11 months and began to use short sentences by age 3. He had always been very focused on trucks, cars, and trains. According to his mother, he had always been “very shy” and had never had a best friend. He struggled with jokes and typical childhood banter because “he takes things so literally.” Brandon’s mother had long seen this behavior as “a little odd” but added that it was not much different from that of Brandon’s father, a successful attorney, who had similarly focused interests. Both of them were “sticklers for routine” who “lacked a sense of humor.”On examination, Brandon was shy and generally nonspontaneous. He made below-average eye contact. His speech was coherent and goal directed. At times, Brandon stumbled over his words, paused excessively, and sometimes rapidly repeated words or parts of words. Brandon said he felt okay but added he was scared of school. He appeared sad, brightening only when discussing his toy cars. He denied suicidality and homicidality. He denied psychotic symptoms. He was cognitively intact.","Autism spectrum disorder without accompanying intellectual impairment, with accompanying language impairment: childhood-onset fluency disorder (stuttering)","Brandon presents with symptoms consistent with autism spectrum disorder (ASD), a new diagnosis in DSM-5. ASD incorporates several previously separate disorders, namely autistic disorder (autism), Asperger’s disorder, and pervasive developmental disorder not otherwise specified. ASD is characterized by two main symptom domains: social communication deficits and a fixated set of interests and repetitive behaviors.It is evident that Brandon has considerable difficulty in his peer social interactions. He is unable to form friendships, does not engage in interactive play, and struggles with reading social cues. People with ASD typically find it challenging to correctly interpret the relevance of facial expressions, body language, and other nonverbal behaviors. He is humorless and “takes things so literally.” These symptoms meet the ASD criteria for social communication deficits.In regard to the second ASD symptom domain, Brandon has fixated interests and repetitive behaviors that cause significant distress. He seems interested in cars and trains, has little interest in anything else, and has no apparent insight that other children might not share his enthusiasms. He requires “sameness,” with distress arising if his routine is altered. Brandon meets both of the primary symptomatic criteria, therefore, for DSM-5 ASD.Brandon also stumbles over his words, pauses excessively, and repeats words or parts of words. These symptoms are consistent with stuttering, which is classified as one of the DSM-5 communication disorders, namely childhood-onset fluency disorder. Typically persistent and characterized by frequent repetitions or prolongations of sounds, broken words, pauses in speech, and circumlocutions, childhood-onset fluency disorder may result in significant social, academic, and occupational dysfunction.Other DSM-5 communication disorders include difficulties in speech production (speech sound disorder), difficulty in use of spoken and written language (language disorder), and difficulty in the social uses of verbal and nonverbal communication (social [pragmatic] communication disorder). Although these difficulties are not noted in the case report, Brandon should be evaluated for each of these, because language impairments are so commonly part of ASD that they are listed as specifiers of ASD rather than as separate, comorbid diagnoses.Prior to DSM-5, Brandon would have met criteria for Asperger’s disorder, which identified a cluster of individuals with core autism features (social deficits and fixated interests) and normal intelligence. Perhaps because he shared autism spectrum symptoms with his own father, however, Brandon was viewed as “a little odd” but without problems that merited specific clinical attention. The lack of a diagnosis contributed to Brandon’s having become the defenseless target of malicious bullying, a not uncommon finding in people with ASD. Without appropriate interventions for both his core autism symptoms and his stuttering, Brandon is at serious risk for ongoing psychological trauma and academic derailment."Academic Difficulties,1.3,"Carlos, a 19-year-old Hispanic college student, presented to a primary care clinic for help with academic difficulties. Since starting college 6 months earlier, he had done poorly on tests and been unable to manage his study schedule. His worries that he was going to flunk out of college were leading to insomnia, poor concentration, and a general sense of hopelessness. After a particularly tough week, he returned home unexpectedly, telling his family that he thought he should quit. His mother quickly brought him to the clinic that had previously helped both Carlos and his older brother. The mother specifically wondered whether Carlos’s “ADHD” might be causing his problems, or whether he had outgrown it.Carlos had been seen at the same clinic when he was age 9, at which time he had been diagnosed with attention-deficit/hyperactivity disorder (ADHD), predominantly combined type. Notes from that clinical evaluation indicated that Carlos had been in trouble at school for not following instructions, not completing homework, getting out of his seat, losing things, not waiting his turn, and not listening. He had trouble concentrating except in regard to video games, which he “could play for hours.” Carlos had apparently been slow to talk, but his birth and developmental histories were otherwise normal. The family had immigrated to the United States from Mexico when Carlos was age 5. He repeated first grade because of behavioral immaturity and difficulty learning to read. The ease with which Carlos learned English, his second language, was not noted.During the evaluation when Carlos was age 9, a psychoeducational assessment by a clinical psychologist confirmed reading problems (particularly problems in reading fluency and comprehension). Carlos did not, however, meet the school board criteria for learning disability, which required evidence of a 20-point discrepancy between IQ and achievement scores. Thus, he was not eligible for special education services. Carlos’s primary care physician had recommended pharmacotherapy, but the mother did not want to pursue medication. Instead, she reported taking on an extra job to pay for tutors to help her son “with concentration and reading.”Since starting college, Carlos reported that he had frequently been unable to remain focused while reading and listening to lectures. He was easily sidetracked and therefore had difficulty handing in his written assignments on time. He complained of feeling restless, agitated, and worried. He described difficulty falling asleep, poor energy, and an inability to “have fun” like his peers. He reported that the depressive symptoms went “up and down” over the course of the week but did not seem to influence his problems with concentration. He denied substance use.Carlos said that he’d had some great teachers in high school who had understood him, helped him get the meaning of what he read, and allowed him to audiotape lectures and use other formats (e.g., videos, wikis, visual presentations) for final assignments. Without this support at college, he said he felt “lonely, stupid, a failure—unable to cope.”Although advised by his high school teacher to do so, he had not registered with the university’s student disability services office. He preferred not to be seen as different from his peers and thought he should be able to get through college by himself.Carlos’s family history was positive for ADHD in his older brother. His father, who died when Carlos was age 7, was reported to have had “dyslexia” and had dropped out of a local community college after one semester.On examination, Carlos wore clean jeans, a T-shirt, and a hoodie that he kept pulling down over his face. He sat quietly and hunched over. He sighed a lot and rarely made eye contact with the clinician. He often tapped his fingers and shuffled in his seat but was polite and responded appropriately to questions. His command of English appeared strong, but he spoke with a slight Hispanic accent. He often mumbled and mispronounced some multisyllabic words (e.g., he said “literalchure” instead of “literature” and “intimate” when he clearly meant “intimidate”). He denied any suicidal thoughts. He appeared to have reasonable insight into his problems.Carlos was referred to a psychologist for further testing. The psychoeducational reassessment confirmed that Carlos’s reading and writing abilities were substantially and quantifiably below those expected for his age. That report also concluded that these learning difficulties were not attributable to intellectual disability, uncorrected visual or auditory acuity, psychosocial adversity, or lack of proficiency in the language of academic instruction. The report concluded that Carlos had specific difficulties with reading fluency and comprehension as well as spelling and written expression.","Attention-deficit/hyperactivity disorder, with predominantly inattentive presentation, of mild to moderate severitySpecific learning disorder, affecting the domains of reading (both fluency and comprehension) and written expression (spelling and organization of written expression), all currently of moderate severity","Carlos presents with a history of ADHD. When he was first evaluated at age 9, DSM-IV criteria for ADHD required six of the nine symptoms listed in either of the two categories: inattention or hyperactivity-impulsivity (as well as an onset before age 12). He had been diagnosed as having the combined type of ADHD, indicating the specialty clinic had found at least six symptoms in each of these spheres.Carlos now presents at age 19, and the case report indicates that he has five different inattentive symptoms and two symptoms related to hyperactivity-impulsivity. This seems to indicate a symptomatic improvement. Partial remission of ADHD is common with age, especially in regard to hyperactivity symptoms. Under DSM-IV, Carlos’s ADHD would be said to have remitted. DSM-5, however, has a lower threshold of five symptoms in either category, rather than six. Carlos, therefore, does meet this diagnostic criterion for ADHD.It is important to look for alternative explanations to ADHD, however, and one possibility is that his current symptoms might be better explained by mood disorder. During the past 6 months, Carlos has manifested anxious and depressive symptoms, but his inattention and poor concentration are apparently not restricted to or exacerbated by these episodes. His ADHD symptoms are chronic, and he had an onset during childhood without any concurrent mood or anxiety disorders. Moreover, his presenting symptoms of depression seem to have persisted only about 1 week, whereas his school difficulties are chronic.Academic problems are common in ADHD even in the absence of a specific learning disorder (SLD), although SLDs are also commonly comorbid with ADHD. Even before his repeat psychological testing, Carlos appeared to have multiple historical issues that increase the likelihood of an SLD. His speech was delayed in his first language, Spanish; his reading was slow in both Spanish and English; and he received (and thrived with) educational accommodations in high school. All of these suggest an SLD, as does his positive family history for learning disability.Carlos’s previous psychoeducational assessment failed to confirm a learning disorder because he did not meet the required discrepancy between IQ and achievement for diagnosis with an SLD. Based on an additional decade of evidence, DSM-5 has eliminated this discrepancy criterion for SLD. This change has made it reasonable to refer older adolescent patients for reevaluation.The repeat psychological testing indicates a moderately severe SLD. Because Carlos’s learning difficulties began when he was school age and continue to cause academic impairment, he meets the DSM-5 diagnostic criteria for SLD. By providing documentation of both ADHD and SLD, Carlos will be able to access academic accommodations that should allow him to more robustly pursue his college studies."