Name,Case,Body,Diagnoses,DiscussionAbdominal Pain,9.5,"A hospital-based psychiatric consultation-liaison service was called to assess possible depression in Rebecca Ehrlich, a 24-year-old woman who had been hospitalized 2 days earlier for severe abdominal pain. She had been admitted through the emergency room for the latest flare-up of her underlying Crohn’s disease. The consultation was called after the nurses became concerned that she was sad and lonely and was having a difficult time adjusting to her medical condition.Ms. Ehrlich was interviewed by the medical student on the psychiatry service. The patient indicated that the pain was excruciating and that she was neither sad nor lonely but was simply visiting from out of town, so no one knew she was even in the hospital. She told the medical student that her only previous therapy had been in college, when she went to student health services to get help for anxiety about test taking and her career choice. She had successfully completed a short course of cognitive-behavioral therapy, and the anxiety had not reappeared. She denied any other psychiatric history and had never taken psychiatric medication. In college, she studied psychology and worked part-time as a hospital orderly. Ms. Ehrlich had considered a career in medicine or nursing and asked the student how he had decided to go to medical school.Ms. Ehrlich said that she had previously worked regularly and had “quite a few friends” but that the recurrent abdominal pain had wrecked her social life and her job prospects. She had lost a job the year before because of absenteeism and had missed several job interviews due to her Crohn’s flares. She had dated as a teenager but had been single since college. These things “were not the end of the world, but how would you feel?” As a member of an online bowel disorders support group, Ms. Ehrlich e-mailed other members on a daily basis. She added that the only person in the family who “got” her was an aunt who also had Crohn’s disease.The primary medical team was having difficulty obtaining collateral information from previous physicians, but the medical student was able to contact Ms. Ehrlich’s mother. She did not know the exact names or phone numbers of her daughter’s medical providers but did recall some of the hospitals and could recall, approximately, some of the physicians’ names. She added that her daughter had not wanted her to be involved in her care and had not told her she was out of town, much less that she was in the hospital. She did say that the Crohn’s disease had been diagnosed 2 years earlier, during her daughter’s last semester of college. The mother estimated that Ms. Ehrlich had been hospitalized at least six times, in contrast with the daughter’s report of two earlier hospitalizations. Neither the gastrointestinal (GI) team nor the medical student was able to locate Ms. Ehrlich’s primary gastroenterologist, whose name the patient could only spell phonetically.On examination, Ms. Ehrlich was cooperative and conversant, and appeared comfortable. Her speech was fluent. She appeared calm and unworried about her upcoming procedures. Her thought process was linear. She denied paranoia, hallucinations, or suicidality. Attention and both recent and remote memory were intact. She acknowledged that it had been difficult living with Crohn’s disease, but she was optimistic that her symptoms would improve. She denied depressive symptoms. She looked sad at the beginning of the interview, but she appeared more engaged and euthymic the more she talked. She could not explain why the team was unable to locate her doctor and became irritated when the medical student pressed more specifically to elicit further details about her prior care. She was taken to have an endoscopy and a colonoscopy at the end of the interview.Ms. Ehrlich’s endoscopy and colonoscopy results were normal. That evening, the medical student from psychiatry sat in with the GI team as they reviewed the normal results with the patient. She said she was relieved there was no longer anything seriously wrong with her. The GI team told her that she could be discharged the next morning and that she should have her internist call them. She readily agreed.After the GI team left, Ms. Ehrlich told the student that she was “feeling better already.” She quickly removed her own intravenous line and started to get dressed. The student went to get the primary GI team. When they returned, the patient was gone.The medical student spent much of the next day calling hospitals and physicians that met descriptions provided by the patient and her mother. That afternoon, one of the physicians called back and indicated that he had treated Ms. Ehrlich 6 months earlier at a hospital near her mother’s home. That admission was strikingly similar: after a short hospitalization, she quickly fled from the hospital after a normal colonoscopy.","Factitious disorder, recurrent","The case of Ms. Fredholm illustrates how physiological and psychological factors interact in complex ways to influence symptoms, emotions, behaviors, and medical care. In refusing elements of her treatment (i.e., BiPAP), Ms. Fredholm impedes optimal management and perhaps contributes to a negative outcome (intubation). Her behavior seems to be related to primary affect states (anxiety) as well as emotionally laden beliefs (that others cannot know her body’s needs as well as she and her mother do; that she has been abandoned; that she is not like other patients). Her anxiety may in turn cause physiological changes (e.g., hypoxia, cerebral vasoconstriction) that further contribute to the experience of anxiety.The DSM-5 diagnosis of psychological factors affecting other medical conditions (PFAOMC) describes a cluster of patients who have a medical problem that is adversely affected by psychological or behavioral factors. These factors include psychological distress, patterns of interpersonal interaction, coping styles, and maladaptive coping strategies such as denial of symptoms and poor adherence to medications, diagnostic tests, and treatments. The diagnosis is reserved for situations, like that of Ms. Fredholm, in which the psychological or behavioral issues lead directly to an exacerbation of the medical condition.The differential diagnosis for PFAOMC is broad. Somatic symptom disorder (SSD), illness anxiety disorder (IAD), and factitious disorder also present with a blurring of psychological and physical signs and symptoms, and commonly leave the clinician with the impression that patients’ medical issues are in some way related to underlying emotional issues. In contrast to PFAOMC, SSD and IAD focus on situations in which the perception of—or fear of—physical symptoms influences emotions or behavior, rather than the reverse. People with factitious disorder induce medical complications by their behavior, but theirs is a conscious effort at deception.Many psychiatric conditions—ranging from the substance use disorders to the psychotic, mood, and anxiety disorders—are associated with behaviors that can worsen a comorbid medical condition. In such cases, the other psychiatric condition should generally be noted rather than PFAOMC.At times, however, the diagnosis of PFAOMC can help clarify a situation, even with a patient with a comorbid psychiatric diagnosis. For example, individuals with rigid, manipulative, or otherwise difficult personalities frequently have problematic responses to medical illness and the patient role, often with deleterious effects on their medical care. These patients are well described by the diagnosis of PFAOMC, perhaps in addition to a diagnosis reflecting their maladaptive character traits, such as a personality disorder.The diagnoses of anxiety disorder due to another medical condition and depressive or bipolar disorder due to another medical condition, in which physiological changes directly cause anxiety and mood symptoms, respectively, may also overlap with PFAOMC. Ms. Fredholm’s respiratory issues are presumably contributing to her anxiety; however, what is more salient in this case is how her emotions, beliefs, and behaviors are influencing her medical condition, not the other way around.Denial of medical illness, though not a diagnosable disorder in the current classification system, is commonly seen in clinical settings and can be subsumed under the diagnosis of PFAOMC. Denial may include conscious and unconscious elements; may impact medical care and prognosis substantially; and can take a variety of forms, ranging from complete disavowal of one’s medical condition to subtle renunciations of the medical reality (e.g., the skin cancer survivor who regularly “forgets” to apply sunscreen).PFAOMC is an unusually heterogeneous diagnostic category. Nevertheless, by making explicit a situation in which psychological and behavioral factors are negatively affecting a medical condition, the diagnosis can allow for more effective patient care."Stomachache,10.1,"Thomas, an 8-year-old boy with a mild to moderate intellectual disability, was brought into the emergency room (ER) by his parents after his abdominal pain of the past several weeks had worsened over the prior 24 hours. His parents reported that he had developed constipation, with only one bowel movement in the past week, and that he had vomited earlier in the day. Teachers at his special education classroom for children with intellectual disabilities had written a report earlier in the week indicating that Thomas had been having difficulties since soon after transferring from a similar school in Florida about 4 months earlier. The teachers and parents agreed that Thomas often looked distressed, rocking, crying, and clutching his stomach.One week earlier, a pediatrician had diagnosed an acute exacerbation of chronic constipation. Use of a recommended over-the-counter laxative did not help, and Thomas began to complain of nighttime pain. The discomfort led to a diminished interest in his favorite hobbies, which were video games and sports. Instead, he tended to stay in his room, playing with army men figurines that he had inherited from his grandfather’s collection. Aside from episodes of irritability and tearfulness, he was generally doing well in school, both in the classroom and on the playground. When not complaining of stomachaches, Thomas ate well and maintained his position at about the 40th percentile for height and weight on the growth curve.Thomas’s past medical history was significant for constipation and stomachaches, as well as intermittent headaches. All of these symptoms had worsened several months earlier, after the family moved from a house in semirural Florida into an old walk-up apartment in a large urban city. He shared a room with his younger brother (age 6 years), the product of a normal, unexpected pregnancy, who was enrolled in a regular education class at the local public school. Thomas said his brother was his “best friend.” Thomas was adopted at birth, and nothing was known of his biological parents except that they were teenagers unable to care for the child.On medical examination in the ER, Thomas was a well-groomed boy sitting on his mother’s lap. He was crying and irritable and refused to speak to the examiner. Instead, he would repeat to his parents that his stomach hurt. On physical examination, he was afebrile and had stable vital signs. His physical examination was remarkable only for general abdominal tenderness, although he was difficult to assess because he cried uncontrollably through most of the exam.An abdominal X ray revealed multiple small metallic particles throughout the gastrointestinal tract, initially suspected to be ingested high-lead paint flakes, as well as three 2-centimeter-long metallic objects in his stomach. A blood lead level was 20 μg/dL (whereas normal level for children is < 5 μg/dL). More specific questioning revealed that Thomas, being constipated, often spent long stretches on the toilet by himself. His parents added that although the bathroom was in the process of being renovated, its paint was old and peeling. Consultants decided that the larger foreign bodies in the stomach might not safely pass and could be accounting for the constipation. Endoscopy successfully extricated three antique toy soldiers from Thomas’s stomach.","PicaIntellectual disability, mild to moderate","Thomas is an 8-year-old child with intellectual disability who was brought to an ER with abdominal pain, chronic constipation, irritability, and changes in mood and functioning. All of these symptoms followed his move to a new city and school 4 months earlier. The differential diagnosis for such complaints is broad and includes psychiatric causes, but the first priority is to do a thorough medical workup to search for sources of pain that the child might not be able to explain (e.g., ear infections, urinary tract infections).When abdominal pain and constipation are the chief complaints, an abdominal radiograph generally reveals intestines full of stool. Such a result would prompt a more aggressive bowel regimen, as was recommended the week before by his pediatrician. Thomas’s X ray, however, was unusual in that it revealed not only the residue of lead-based paint chips but also three small toy soldiers.The persistent eating of nonnutritive, nonfood substances is the core feature of pica. To meet DSM-5 criteria, the ingestion must be severe enough to warrant clinical attention. Pica is most commonly comorbid with intellectual disability and autism spectrum disorder, although it can also be found in other disorders, such as schizophrenia and obsessive-compulsive disorder. As seen in Thomas, there is typically no aversion to food in general, and he continued to maintain his position on the growth chart.Pica does not refer simply to the mouthing and occasional ingestion of nonfood objects that is common in infants, toddlers, and individuals with developmental delay. Instead, pica refers to chronic and clinically relevant ingestion of such inedible objects as clay, dirt, string, or cigarette butts. Pica can be extremely dangerous. In Thomas’s case, for example, he could have suffered a gastrointestinal perforation from the soldiers. In addition, he was eating lead-based paint as well as the soldiers (which, being his grandfather’s, could also have been made of lead). The acute lead exposure likely contributed to his abdominal pain, whereas chronic ingestion could be neurologically catastrophic in this boy who already has intellectual disability.In addition to having the abdominal pain, Thomas was isolating himself from his classmates and brother and was irritable and tearful. It is possible that these are reflections of his pain, but they appear to be signs of psychological stress. The pica itself could also be a sign of stress, especially if it began only after the move from Florida. Psychosocial stressors frequently cause multiple physical symptoms in children, especially in those with intellectual disability. Thomas might also qualify, therefore, for a diagnosis of adjustment disorder with depressed mood. If his mood changes are determined to be secondary to the toxic levels of lead in his bloodstream, then a more accurate diagnosis might be a substance-induced depressive or anxiety disorder. In the ER setting, however, the clinician would likely defer making depressive, anxiety, or adjustment disorder diagnoses until having a chance to evaluate Thomas when he was not in acute abdominal distress."Drifting Below the Growth Curve,10.2,"Uma, an 11-year-old girl in a gifted and talented school, was referred to an eating disorder specialist by a child psychiatrist who was concerned that Uma had drifted below the 10th percentile for weight. The psychiatrist had been treating Uma for perfectionistic traits that caused her significant anxiety. Their sessions focused on anxiety, not on eating behavior.Uma’s eating difficulties started at age 9, when she began refusing to eat and reporting a fear that she would vomit. At that time, her parents sought treatment from a pediatrician, who continued to evaluate her yearly, explaining that it was normal for children to go through phases. At age 9, Uma was above the 25th percentile for both height and weight (52 inches, 58 pounds), but by age 11, she had essentially stopped growing and had dropped to the 5th percentile on her growth curves (52.5 inches, 55 pounds).The only child of two professional parents who had divorced 5 years earlier, Uma lived with her mother on weekdays and with her nearby father on weekends. Her medical history was significant for her premature birth at 34 weeks’ gestation. She was slow to achieve her initial milestones but by age 2 was developmentally normal. Yearly physical examinations had been unremarkable with the exception of the recent decline of her growth trajectory. Uma had always been petite, but her height and weight had never fallen below the 25th percentile for stature and weight for age on the growth chart. Uma was a talented student who was well liked by her teachers. She had never had more than a few friends, but recently she had stopped socializing entirely and had been coming directly home after school, reporting that her stomach felt calmer when she was in her own home.For the prior 2 years, Uma had eaten only very small amounts of food over very long durations of time. Her parents had tried to pique her interest by experimenting with foods from different cultures and of different colors and textures. None of this seemed effective in improving her appetite. They also tried to let her pick restaurants to try, but Uma had gradually refused to eat outside of either parent’s home. Both parents reported a similar mealtime pattern: Uma would agree to sit at the table but then spent her time rearranging food on her plate, cutting food items into small pieces, and crying if urged to eat another bite.When asked more about her fear of vomiting, Uma remembered one incident, at age 4, when she ate soup and her stomach became upset and then she subsequently vomited. More recently, Uma had developed fear of eating in public and ate no food during the school day. She denied any concerns about her appearance and only became aware of her low weight after her most recent visit to the pediatrician. When educated about the dangers of low body weight, Uma became tearful and expressed a clear desire to gain weight.","Avoidant/restrictive food intake disorder","Uma is an 11-year-old girl who presents with a refusal to eat enough food to maintain her position on the growth curve. She fears vomiting, will not eat in public, and has gradually isolated herself from her friends. In contrast to individuals with anorexia nervosa (AN), Uma does not report any fear of gaining weight or becoming fat and does not deny the seriousness of her current low body weight. Her diagnosis, therefore, is avoidant/restrictive food intake disorder (ARFID), a new diagnosis in DSM-5. ARFID is a relatively broad category intended to describe a cluster of people who do not meet criteria for AN but whose avoidance or restriction of food leads to health problems, psychosocial dysfunction, and/or significant weight loss. In the case of children like Uma, the diminished food intake might result in a flattening of the growth trajectory rather than weight loss.People with AN have a fear of gaining weight or of becoming fat, whereas people with ARFID lack a disturbance in body image. The distinction between ARFID and AN may be uncertain when individuals deny a fear of weight gain but instead offer diverse explanations for food restriction, such as somatic complaints (e.g., abdominal discomfort, fullness, lack of appetite), religious motives, desire for control, or desire for familial impact. Longitudinal assessment may be necessary to clarify the diagnosis, and ARFID may precede AN in some people.A diagnosis of ARFID is likely to be applied primarily to children and adolescents, but people of any age can have this disorder. Three main subtypes have been described: inadequate overall intake in the presence of an emotional disturbance such that the emotional problem interferes with appetite and eating but the avoidance does not stem from a specific motive; restricted range of food intake (sometimes referred to as “picky eating”); and food avoidance due to a specific fear such as fear of swallowing (functional dysphagia), fear of poisoning, or fear of vomiting.Uma fears going out and appears to avoid friends and social experiences. Such behavior might be consistent with a specific phobia, in that Uma specifically feared vomiting in public. Although specific phobia may be concurrent with an eating disorder, a diagnosis of ARFID is likely a more parsimonious explanation. As outlined in DSM-5, ARFID should be diagnosed in the presence of symptoms compatible with another diagnosis when the severity of the eating disturbance exceeds that routinely associated with the other condition and warrants additional clinical attention.In Uma’s case, a variety of other disorders should also be considered during the evaluation. These include medical, structural, and neurological disorders that can impede eating; obsessive-compulsive disorder; and depressive and anxiety disorders that might have emerged in the context of her parents’ divorce and her progression toward puberty. Although any of these might be further explored, none of them seem immediately pertinent to Uma’s weight loss."