Name,Case,Body,Diagnoses,DiscussionCoping With Parkinson’s Disease,4.9,"George Anderson, a 79-year-old man, was referred to a psychiatrist for an evaluation of depression. For most of the 6 years since his diagnosis with Parkinson’s disease (PD), Mr. Anderson had coped well and continued to engage in many of his usual activities.Three months prior to the referral, however, Mr. Anderson began to decline social invitations from family and friends. He reported that he had withdrawn socially because he had lost pleasure in things that used to excite him, although he denied persistent feelings of sadness or worry. He recognized that he was not his “usual self” and tried, to no avail, to give himself “pep talks.” He had worked as a high school science teacher until retirement at age 67, and reported having learned “the power of seeing the glass half full” from his students. He felt frustrated that he could not “snap out of it” for the first time in his life but was hopeful about getting professional help. He denied wishing for death, explaining that although he was not afraid of death, he wanted to enjoy life as long as possible. He added, “God does not give me more than I can handle. I can’t ask for a better family, and I have had a full life.”Other new symptoms noted over the prior few months included increasing fatigue, trouble with concentration and memory, unintentional weight loss (7% of his body mass index over 2 months), and restless sleep with initial insomnia.His wife of 54 years had also noticed that for nearly 2 years, Mr. Anderson had been thrashing his body in the bed halfway through the night, occasionally striking her in his sleep. When he awoke from such an incident, he was coherent and often reported he had been dreaming of swimming or running from something. His wife took over driving shortly after his PD diagnosis, but he was otherwise independent in activities of daily living such as paying bills and managing his medications. His wife described him as “maybe a little more forgetful” over the past few years, but neither of them was concerned about this mild memory loss.Past medical history included prostate cancer (in remission), glaucoma, and gout. Family psychiatric history was positive only for a granddaughter with autism. He reported no past troublesome substance use and drank a glass of wine two or three times a year. He denied any previous depressive episodes, psychiatric treatment, or psychiatric evaluations.On mental status examination, Mr. Anderson was pleasant, cooperative, and interpersonally engaging. He had a mild to moderate resting tremor, shuffling gait, hypophonia, and bradykinesia. He occasionally smiled, but his affect was difficult to gauge due to significant masked facies. He reported his mood as “blah.” There was no evidence of psychosis.On cognitive testing, he had some difficulty on the Trail Making Test part B, figure copying, and word-list recall, the latter being helped by category prompts. He scored 25 out of 30 on the Montreal Cognitive Assessment (MCA).","Depressive disorder due to another medical condition (Parkinson’s disease), with major depressive–like episodeRapid eye movement sleep behavior disorder","Although Mr. Anderson denies sad mood, he does have evidence of anhedonia along with five other depressive symptoms (appetite/weight loss, insomnia, fatigue, poor concentration, and psychomotor retardation), all for greater than 2 weeks. These symptoms are distressing to him and are significantly impacting his social functioning. This could indicate major depressive disorder (MDD). However, Mr. Anderson has no personal or family history of depressive disorders, an atypically late age at onset, symptom development during the course of PD, and no identifiable acute life stressor. Clinically significant depression occurs in approximately one of three PD cases. Thus, it is more likely that his depressive symptoms are related to physiological changes in the central nervous system caused by PD.When depressive symptoms are temporally associated with the onset or progression of another medical condition, and are not explained by delirium, the DSM-5 diagnosis “depressive disorder due to another medical condition” should be considered. This diagnosis is intended for situations in which the direct physiological effects of another medical condition (e.g., neurodegeneration in Parkinson’s disease) cause depressive symptoms. In other words, this diagnosis is not intended to describe individuals whose symptoms derive from a psychological reaction to illness, which would instead be classified as an adjustment disorder, with depressed mood. These two possible etiologies of depressive symptoms (physiological versus psychological) are somewhat artificially dichotomized and may coexist. There are, however, many cases when the evidence heavily suggests one more than the other. Mr. Anderson’s previous resiliency in the face of developing Parkinson’s disease and his ongoing positive coping style make the diagnosis of adjustment disorder less likely.If the criteria for symptom duration and number are met for MDD, the specifier “with major depressive-like episode” should be added to the diagnosis. Because symptoms from a nonpsychiatric medical illness can overlap with depressive symptoms, diagnostic ambiguity may arise. For instance, persons with PD often experience symptoms such as fatigue, psychomotor retardation, sleep disturbance, cognitive impairment, and weight loss independent of depressed mood or anhedonia. However, in Mr. Anderson’s case, these symptoms developed or worsened in conjunction with his new-onset anhedonia, which suggests a major depressive–like episode due to another medical condition.As often occurs in PD, Mr. Anderson has a sleep disturbance consistent with rapid eye movement (REM) sleep behavior disorder. This sleep disorder is characterized by “repeated episodes of arousal during sleep associated with vocalization and/or complex motor behaviors” that may result in “injury to self or the bed partner.” Upon awakening, affected persons typically have a clear sensorium and a sense of having “acted out” their dreams. Polysomnography would reveal absence of atonia during REM sleep but would not be required in order to make the diagnosis in the context of a synucleinopathy such as PD. Symptoms typically occur 90 minutes or more into sleep and more often in the second half of the night, when REM sleep is more common. Although Mr. Anderson’s history is consistent with REM sleep behavior disorder, his new initial insomnia is not explained by this diagnosis and is more consistent with depression.Cognitive changes, particularly impairments of visuospatial, executive, and memory retrieval functions, often occur in PD. Mr. Anderson’s MCA results are typical of such cognitive changes, but his new-onset subjective difficulty with concentration is more likely secondary to depression. His cognitive problems are mild and not overtly impairing; he does not meet criteria for an independent neurocognitive disorder, although prospective monitoring of cognition would be wise, given that 25%–30% of persons with PD develop dementia.In addition to meeting criteria for two DSM-5 disorders, Mr. Anderson displays evidence of resilience, wisdom, and other signs of psychological health. He demonstrates positive coping skills (e.g., cognitive reframing, use of social supports), long-term healthy relationships, spirituality, gratitude, optimism, and developmentally appropriate ego integrity. He also exhibits a healthy, nonmorbid perspective about personal mortality. Unfortunately, even individuals with few risk factors for depression and with evidence of lifelong healthy psychological functioning are not immune to the neuropsychiatric effects of certain medical conditions."Situational Mood Swings,4.1,"Helena Bates was a 27-year-old single administrative assistant who presented for a psychiatric evaluation and treatment for depression. She had recently begun an intensive outpatient program after a first lifetime hospitalization for an impulsive overdose following the breakup of a 2-year relationship. She said she had been feeling increasingly sad and hopeless for 1–2 months in anticipation of the breakup. About a month prior to admission, she began seeing a new psychotherapist who told her she had “borderline traits” and “situational mood swings.”During these 4–8 weeks, Ms. Bates’s mood had been moderately depressed throughout the day most days, with no diurnal variation and intact mood reactivity. She had recently gained about 10 pounds from “overeating comfort food and junk.” She denied prominent irritability or argumentativeness. She described her self-esteem as “none” and had found it hard to feel motivation or to concentrate on routine tasks. By contrast, sometimes she would have “bursts” of nonstop thinking about her estranged boyfriend and devising ways to “get him back,” alternating with “grieving his loss.” She described times of being flooded with strategies to regain his interest (including purchasing a full-page newspaper “open letter” to him) and recently found herself awake until 5:00 or 6:00 a.m. journaling or calling friends in the middle of the night “for support.” She would then “trudge through the day” without fatigue after only 2–3 hours of sleep. These symptoms began prior to her hospitalization. She denied drug or alcohol misuse and self-injurious behavior. Until this particular breakup, she denied a history of particularly intense or chaotic relationships, as well as a history of suicidal thoughts or gestures. Indeed, Ms. Bates seemed horrified by her own overdose, which occurred in the context of a depression.Previously, Ms. Bates had seen a counselor in high school for “moodiness” and poor grades. She became “depressed” in college. At that time, she began escitalopram and psychotherapy, but improved quickly and stopped both after a few weeks. While in the hospital following her suicide attempt, she started taking vilazodone and quetiapine at bedtime “for sleep.”Ms. Bates was the youngest of three children who grew up in a middle-class suburban home. She attended public school and a state college as “mostly a B student” and hoped to someday go to law school. She described herself as having been a “quiet, anxious” child and “not a troublemaker.” Her older brother abused multiple substances, although Ms. Bates said she herself had never used illicit substances. Her younger sister was treated for “panic attacks and depression,” and Ms. Bates knew of several aunts and cousins whom she thought were “depressed.”On examination, Ms. Bates was a pleasant, well-related, casually but appropriately dressed, moderately overweight woman, appearing her stated age, who made good eye contact. Her speech was somewhat rapid and verbose but interruptible and nonpressured. She had no abnormal motor movements, but she gestured dramatically and with excessive animation. Her mood was depressed, and her affect was tense and dysphoric but with full range and normal responsivity. Ms. Bates’s thought processes were somewhat circumstantial but generally coherent, linear, and logical. Her thought content was notable for passive thoughts that she might be better off dead, but without intent or plan; she had no delusions, hallucinations, or homicidal thoughts. Her higher integrative functioning was grossly intact, as were her insight and judgment.","Major depressive disorder with mixed features","Ms. Bates meets DSM-5 criteria for a major depressive episode, manifesting pervasive depressed mood with at least five associated features (suicidal thoughts, poor concentration, low self-esteem, hyperphagia, and psychomotor agitation). She also describes several symptoms consistent with mania or hypomania: a decreased need for sleep with nocturnal hyperactivity and no consequent next-day fatigue, probable racing thoughts, and rapid, verbose speech (as noted on interview). Although the examiner deemed Ms. Bates’s insight and judgment globally intact at the time of the interview, some of her recent thoughts (e.g., posting an open letter in a newspaper) and actions (calling friends in the middle of the night) suggest impaired judgment involving behaviors with the potential for painful consequences.Although Ms. Bates does have some manic symptoms, she does not meet DSM-5 requirements for a diagnosis of mania or hypomania. She would be said to have subsyndromal hypomania along with the syndromal depression. This combination qualifies her for a new diagnosis in DSM-5: major depressive disorder with mixed features. Previously, “mixed features” applied only to bipolar I disorder, whereas the term can now modify major depression and both bipolar I and bipolar II disorders.The DSM-5 construct of unipolar depression with mixed features reflects observations that many unipolar depressed patients display subthreshold signs of hypomania. DSM-5 “disallows” counting four potential manic/hypomanic symptoms, because they can also reflect major depression—namely, insomnia (as opposed to decreased need for sleep), distractibility, indecisiveness, and irritability. DSM-5 identifies “abnormally and persistently increased activity or energy” as a mandatory criterion for diagnosing bipolar II hypomania, but this feature is not necessary to define unipolar depression with mixed features. In the present case, if Ms. Bates had irritable mood in addition to her racing thoughts, rapid speech, and decreased need for sleep, she would meet DSM-5 criteria for bipolar II hypomania, and the mixed features specifier would then apply by virtue of her concomitant depressive symptoms.The DSM-5 mixed features specifier requires that symptoms of the opposite polarity (in this case, mania/hypomania) be present “almost every day during the episode.” This latter criterion means that if Ms. Bates’s manic/hypomanic symptoms had been present for fewer than 4 days (the minimum duration criterion for diagnosing bipolar II hypomania), her subthreshold hypomania symptoms would not count toward either a “mixed” or a “manic/hypomanic” designation and her diagnosis would simply be unipolar major depression. Some authors have criticized DSM-5’s stringency of discounting subthreshold hypomania symptoms if they involve only two manic/hypomanic symptoms or if they fail to persist for the full duration of an episode, because such presentations (referred to in the literature as “depressive mixed states”) have been observed when as few as two mania/hypomania symptoms coexist with syndromal unipolar depression for as few as 2–4 days, and represent a construct that more closely resembles bipolar than unipolar disorder in family history, age at onset, and suicide risk.One might speculate that Ms. Bates’s psychomotor activation and subthreshold hypomania could have arisen as a consequence of the recent introduction of the selective serotonin reuptake inhibitor (SSRI) vilazodone. However, in this case, the history indicates that her hypomanic symptoms predated her hospitalization and SSRI introduction; it would be important for the examiner to determine that this chronology is accurate (which would suggest that her mixed symptoms are not iatrogenic), because the mixed features specifier requires that symptoms be “not attributable to the physiological effects of a substance.” Note that this qualifying statement is in contrast to the DSM-5 criteria for a manic/mixed/hypomanic episode, insofar as the emergence of mania/hypomania symptoms associated with recent antidepressant exposure is now classified as a bipolar disorder (similar to the viewpoint in DSM-III-R) and no longer as a substance-induced mood disorder (as in DSM-IV-TR).Major depression patients with subthreshold hypomania have about a 25% chance of eventually developing a full mania or hypomania. Therefore, although not all major depression patients who display subthreshold mixed features will develop syndromal mania or hypomania, such patients warrant particularly careful evaluation, treatment, and longitudinal monitoring.Ms. Bates’s symptoms of impulsivity and hyperactivity may have contributed to her acute presentation being wrongly identified as borderline personality disorder. Her longitudinal history does not support a pattern of symptoms suggestive of borderline personality disorder, and her suicide attempt and affective instability are readily accounted for by a current full affective syndrome."Floundering,4.11,"Ian Campbell was a 32-year-old man who presented for psychiatric consultation because he was floundering at work. When he failed to make progress on a simple project, his boss expressed concern. Mr. Campbell offered that he had been distracted by problems at home. More seemed wrong, the boss suggested. Mr. Campbell phoned his internist, who sent him to a neurologist, who referred Mr. Campbell for psychiatric evaluation.Mr. Campbell had encountered this problem, difficulty concentrating, before. In college, after his father died of a chronic illness, Mr. Campbell had been unable to study and had taken time off. Twice at his prior job, he experienced episodes lasting months in which he had difficulty making decisions. One of these intervals followed a romantic setback.Mr. Campbell’s mother and sister had been diagnosed with major depression and treated successfully with medication. A maternal uncle had committed suicide.The current impairment’s onset accompanied the breakdown of Mr. Campbell’s marriage of 6 years. Two months earlier, his wife had filed for divorce, announcing that she would live in the distant city her work had taken her to. Mr. Campbell had expected to feel relief; he said his wife had been hostile throughout the marriage. He had begun to entertain fond thoughts of a coworker. Nevertheless, he felt “flat”—unable to imagine a future.Closer questioning revealed that Mr. Campbell’s problems went beyond impaired cognition. He described apathy and diminished energy. Jazz was a passion, but he no longer attended recitals—although impaired concentration probably played a role as well. Listening, the psychiatrist noted probable retardation of speech. Mr. Campbell said that his employer had mentioned that Mr. Campbell was moving in slow motion. The problems were worse in the mornings. In the evenings, Mr. Campbell noticed a spark of energy. He put on music and reviewed reports ignored during the workday.Mr. Campbell declined to characterize himself as sad. He was pleased that the marriage was ending. But the psychiatrist was struck by her own affect in Mr. Campbell’s presence; she felt glum, pessimistic, even weepy.She questioned Mr. Campbell at length about depressed mood, changed sleep and appetite, feelings of guilt or worthlessness, and thoughts of death. None of these attributions, he said, applied. Nor had he had indicators of disorders that can be confused with depression. He was not dysthymic; between episodes of impairment, he felt and functioned well.The psychiatrist decided that the problem at hand was close enough to depression to warrant treatment. Factors that influenced her decision included the partial syndromal presentation, diurnal variation, periodic recurrence, lack of future orientation, and her own empathic experience. She proposed psychotherapy centered on Mr. Campbell’s decompensation in the face of loss. He insisted that he did not see the impending divorce in that light. The two agreed on brief psychotherapy supplemented by antidepressants. Within weeks, Mr. Campbell was functioning at full capacity. During the treatment, the psychiatrist was unable to elicit evidence of depressive symptoms beyond those noted in the initial history. All the same, she was convinced that the impaired concentration was a sign and symptom of something very much like major depression.","Other specified depressive disorder (depressive episode with insufficient symptoms)","The operational definition of major depression, which reached official standing in the third edition of DSM, is one of the great inventions in modern medicine. The approach has catalyzed productive research in fields ranging from cell biology to social psychiatry. Most of what is known about mood disorder, from the abnormalities it represents in the brain to the harm it does in lives, arises from the delineation of depression out of the inchoate domain of neurosis and psychosis.That said, the definition is arbitrary. Historians have traced the DSM criteria to a 1957 Journal of the American Medical Association article whose lead author, a Boston psychiatrist, Walter Cassidy, had tried to systematize the study of a condition similar to today’s major depression. For diagnosis, Cassidy required that patients have six of 10 symptoms from a list that included slow thinking, poor appetite, loss of concentration, and others that remain current. Later asked how he chose six, Cassidy said, “It sounded about right.”Operational approaches to depression, from DSM to the Hamilton Rating Scale for Depression, are attempts to create reliability in the face of an inherently ill-defined phenomenon—that is, clinicians’ working diagnoses. Psychiatrists identified depressed patients using prevailing methods—sometimes with attention to their own empathic resonance with the patient; the symptom- and severity-based definitions translated the impressionistic into reproducible form.Depression, however, has no known natural boundary. Behavioral geneticists find the DSM criteria arbitrary. Number, severity, and duration of symptoms each represent a continuum of disability. Patients who suffer four severe symptoms of depression for 2 weeks tend to do badly down the road. Five moderately disabling symptoms for 10 days confer a poor prognosis. Five mild symptoms, if they persist, predict substantial risk.In this case, Mr. Campbell appears not to have had the five of nine criteria necessary for a diagnosis of major depression, but he would likely qualify for a DSM-5 diagnosis of other specified depressive disorder (depressive episode with insufficient symptoms). It is important to recognize that depression’s harm—suffering, future full episodes, work and social problems, suicide—is only slightly less in people who narrowly miss full criteria. In one analysis, later major depression was as common in those who reported three or four symptoms as in those who reported five. Estimates of heritability are similar, too; “minor” depression in one sibling predicts full depression in an identical twin. One form of other specified depressive disorder appears especially dangerous: recurrent brief depression is associated with high rates of attempted suicide.The DSM-5 categories unspecified and other specified depressive disorders acknowledge an important clinical reality: effectively, the near penumbra of depression is depression. Low-level episodes can appear as precursors of major depression and as sequelae, even in the absence of dysthymia; on its own, low-level depression represents suffering and confers risk.Mr. Campbell’s doctor will want to take his complaints seriously. Mr. Campbell may have entered a “depressive episode with insufficient symptoms,” but the insufficiency relates to the symptom count for a major depressive episode, not to the level of illness needed to trigger clinical concern. Especially when peripheral factors—such as, in this case, the diurnal variation typical of classic depression—suggest mood disorder, the clinician will suspect that effectively the condition is depression and will approach the situation with the corresponding urgency and thoroughness."